{
  "output_record_id": "out_civic_garden_inline_photo_hose_001",
  "previous_output_record_id": null,
  "project_id": "proj_civic_garden_hook_article",
  "source_id": "src_civic_garden_hook_article",
  "artist_meaning_id": "meaning_civic_garden_hook_article",
  "transformation_brief_id": "tb_civic_garden_hook_article",
  "beat_plan_id": "bp_civic_garden_hook_article",
  "medium_plan_id": "imp_civic_garden_hook_article",
  "brief_id": "brief_civic_garden_photos",
  "prompt_plan_id": "plan_civic_garden_photos",
  "prompt_branch_set_id": null,
  "prompt_branch_id": null,
  "prompt_variant_type": null,
  "target_media_type": "image",
  "output_artifact": {
    "artifact_id": "artifact_civic_garden_inline_photo_hose_001",
    "artifact_kind": "image",
    "uri_or_path": "workspace-library/artist-os/projects/proj_civic_garden_hook_article/assets/imported/coiled-hose-left-ready.jpg",
    "mime_type": "image/jpeg",
    "description": "Accepted inline photo: a hose coiled and left ready beside the tap, no person in frame.",
    "rights_notes": "Artist-owned rehearsal photo; no real user media."
  },
  "origin": {
    "origin_type": "artist_imported",
    "created_by": "artist",
    "generation_approval_ref": null
  },
  "generation": {
    "provider": null,
    "model": null,
    "settings": {
      "import_route": "artist-os-import-output"
    },
    "seed": null,
    "estimated_cost": null,
    "actual_cost": null
  },
  "review_state": {
    "output_critic_review_required": true,
    "review_record_id": "review_civic_garden_photo_hose_output",
    "review_status": "approved"
  },
  "acceptance_state": {
    "output_acceptance_status": "accepted",
    "accepted_work": true,
    "artist_decision_ref": "gate_civic_garden_photo_hose_acceptance",
    "waiver_reason": null
  },
  "traceability_summary": [
    {
      "source_type": "medium_plan",
      "source_ref": "imp_civic_garden_hook_article",
      "note": "The supporting Image Medium Plan placed this photo at the article's reframing turn."
    },
    {
      "source_type": "output_record",
      "source_ref": "out_civic_garden_article_text_001",
      "note": "The photo takes continuity from the accepted article realization, per the Cross-Medium Plan production order."
    }
  ],
  "created_at": "2026-07-25T13:50:00Z"
}
